{
  "schemaVersion": "0.2.0",
  "kind": "dependency",
  "id": "io.github.theboyyss.missingxeditauditrecordinspectionrequirement.dependencies",
  "requires": {
    "capabilities": [
      {
        "id": "tool.xedit",
        "phase": [
          "generation"
        ],
        "reason": "Deliberately incomplete xEdit audit requirement fixture."
      }
    ]
  }
}
