{
  "schemaVersion": "0.2.0",
  "kind": "dependency",
  "id": "io.github.theboyyss.xeditauditexample.dependencies",
  "requires": {
    "capabilities": [
      {
        "id": "tool.xedit.record_inspection",
        "phase": [
          "generation"
        ],
        "reason": "Plan future xEdit audit script and report evidence."
      }
    ]
  }
}
